{"$schema":"https://json-schema.org/draft/2020-12/schema","$id":"https://rust-learning-lab.dev/schemas/interview-category-v1.schema.json","title":"Rust Learning Lab interview category","type":"object","additionalProperties":false,"required":["schema_version","id","order","title","focus","levels","references"],"properties":{"$schema":{"type":"string"},"schema_version":{"const":1},"id":{"type":"string","pattern":"^[a-z0-9]+(?:-[a-z0-9]+)*$"},"order":{"type":"integer","minimum":1},"title":{"type":"string","minLength":1},"focus":{"type":"array","minItems":1,"items":{"type":"string","minLength":1}},"levels":{"type":"array","minItems":1,"uniqueItems":true,"items":{"enum":["foundation","working_rust_developer","senior_rust_developer","systems_performance_specialist"]}},"references":{"type":"array","minItems":1,"items":{"$ref":"#/$defs/reference"}}},"$defs":{"reference":{"type":"object","additionalProperties":false,"required":["title","path"],"properties":{"title":{"type":"string","minLength":1},"path":{"type":"string","minLength":1}}}}}
